{
  "schemaVersion": "cryptocomm-compatibility-record/v1",
  "recordId": "synthetic-compatible-record",
  "subject": {
    "packId": "synthetic-contract-pack",
    "packVersion": "0.1.0-synthetic.1",
    "manifestDigest": {
      "algorithm": "sha256",
      "value": "3f1dc97270ce81f7f3c33aac33c21a731cd8c967c4fc03ebac6b63658fdc3a92"
    },
    "manifestSource": {
      "repositoryId": "synthetic:example/pack-source",
      "revision": {
        "algorithm": "git-sha1",
        "value": "1111111111111111111111111111111111111111"
      },
      "tree": {
        "algorithm": "git-sha1",
        "value": "2222222222222222222222222222222222222222"
      }
    }
  },
  "target": {
    "implementation": {
      "implementationId": "synthetic/target-adapter",
      "version": "0.1.0-synthetic.1",
      "sourceRepositoryId": "synthetic:example/target-adapter",
      "sourceRevision": {
        "algorithm": "git-sha1",
        "value": "4444444444444444444444444444444444444444"
      }
    },
    "contract": {
      "contractId": "synthetic-assurance-target/v1",
      "version": "1.0.0-synthetic.1"
    }
  },
  "state": "compatible",
  "evidence": {
    "evidence/synthetic-compatibility-result": {
      "digest": {
        "algorithm": "sha256",
        "value": "3529d805508207c3ca273d72a53c6a176728a8d7fcecdb0b7fd51d93ff735931"
      },
      "mediaType": "application/json",
      "evidenceType": "synthetic-test-result"
    }
  },
  "safety": {
    "executable": false,
    "networkRequired": false,
    "secretsAllowed": false
  },
  "fixtureClassification": "synthetic-test-only"
}
